<?xml version="1.0" encoding="UTF-8"?>
<?xml-stylesheet type="text/xsl href="WEB-INF/tutors.xsl"?>
<tutors
    xmlns:xsi="http://www.w3.org/2001/XMLSchema-instance"
    xsi:noNamespaceSchemaLocation="tutors.xsd"> 
<!--<tutors>-->
        <tutor>
            <name>Chris Burney</name>
            <email>chrisburney@tutor.com</email>
            <password>password</password>
            <dob>1968-11-02</dob>
            <userType>Tutor</userType>
            <subject>WSD</subject>
            <status>Available</status>
        </tutor>

        <tutor>
            <name>Selina Madrid</name>
            <email>smadrid@tutor.com</email>
            <password>password123</password>
            <dob>1986-04-29</dob>
            <userType>Tutor</userType>
            <subject>USP</subject>
            <status>Available</status>
        </tutor>

        <tutor>
            <name>Maxwell Parra</name>
            <email>maxparra@tutor.com</email>
            <password>password123</password>
            <dob>1970-08-12</dob>
            <userType>Tutor</userType>
            <subject>SEP</subject>
            <status>Available</status>
        </tutor>

        <tutor>
            <name>Jonah Stockton</name>
            <email>jstockton@tutor.com</email>
            <password>password123</password>
            <dob>1979-09-09</dob>
            <userType>Tutor</userType>
            <subject>AppProg</subject>
            <status>Available</status>
        </tutor>

        <tutor>
            <name>Martin Silver</name>
            <email>martinsilver@tutor.com</email>
            <password>password123</password>
            <dob>1985-10-22</dob>
            <userType>Tutor</userType>
            <subject>MobileApp</subject>
            <status>Available</status>
        </tutor>
    
</tutors>
